{
  "spec_version": "ui-spec-v1",
  "intent": "",
  "title": "Adaptive Briefing",
  "generated_by": "client",
  "panels": [
    {
      "id": "p1",
      "type": "note",
      "title": "Plan",
      "span": 12,
      "priority": 1.0,
      "body": "Default adaptive briefing canvas."
    },
    {
      "id": "p2",
      "type": "articles",
      "title": "Latest documents",
      "span": 6,
      "priority": 0.8
    }
  ]
}
